<?xml version="1.0" encoding="ISO-8859-1"?>
<CMSDef xmlns="http://www.freshdirect.com/xsd/CMS"
	xmlns:xsi="http://www.w3.org/2001/XMLSchema-instance"
	xsi:schemaLocation="http://www.freshdirect.com/xsd/CMS CMS.xsd">

	<ContentTypeDef name="Foo">
		<AttributeDefs>
			<AttributeDef type="S" name="name" />
			<AttributeDef type="S" name="value" />
		</AttributeDefs>
	</ContentTypeDef>

	<ContentTypeDef name="SynTest">
		<AttributeDefs>
			<AttributeDef type="S" name="FULL_NAME" />
			<AttributeDef type="S" name="keywords" />
		</AttributeDefs>
	</ContentTypeDef>

</CMSDef>
